{
  "group_id": "d44d5b87-37ce-5db5-9e33-43f477b42f1e",
  "title": "Tuesday Night Group",
  "subtitle": "Tuesdays · 7:00 PM · Lee home, North Park",
  "badge": "Leader",
  "action": {
    "type": "navigate",
    "screen_key": "community.group",
    "params": {
      "group_id": "d44d5b87-37ce-5db5-9e33-43f477b42f1e"
    },
    "presentation": "push"
  }
}
